"DOI","Title","Abstract","Journal","Authors","Keywords","Institute of Origin","Funding","Enrichment Status"
"10.1039/D0SC00512F","Spectroscopic investigations under whole-cell conditions provide new insight into the metal hydride chemistry of [FeFe]-hydrogenase","N/A","N/A","Lívia S. Mészáros, Pierre Ceccaldi, Marco Lorenzi, Holly J. Redman, Emanuel Pfitzner, Joachim Heberle, Moritz Senger, Sven T. Stripp, Gustav Berggren","","","N/A","Success"
"10.1039/D4SC02713B","Coordination of Al(C6F5)3vs B(C6F5)3 on Group 6 End-On Dinitrogen Complexes: Chemical and Structural Divergences.","N/A","N/A","Léon Escomel, Frederico F. Martins, Laure Vendier, Anaïs Coffinet, Nicolas Queyriaux, Vera Krewald, Antoine Simonneau","","","N/A","Success"
"10.1039/D3SC00001J","1-Azahomocubane","N/A","N/A","Tyler Fahrenhorst‐Jones, David L. Marshall, Jed M. Burns, Gregory K. Pierens, Robert E. Hormann, Allison M. Fisher, Paul V. Bernhardt, Stephen J. Blanksby, G. Paul Savage, Philip E. Eaton, Craig M. Williams","","","N/A","Success"
"10.1039/D2SC05975D","Self-recovery of chiral microphase separation in an achiral diblock copolymer system","N/A","N/A","Tengfei Miao, Xiaoxiao Cheng, Gong Zhang, Yuqing Wang, Zixiang He, Zhao Wang, Wei Zhang","","","N/A","Success"
"10.1039/D0SC00505C","Photo-induced carbocation-enhanced charge transport in single-molecule junctions","N/A","N/A","Zhongwu Bei, Yuan Ming Huang, Yangwei Chen, Yiping Cao, Jin Li","","","N/A","Success"
"10.1039/D1SC04017K","Self-assembled cationic organic nanosheets: role of positional isomers in a guanidinium-core for efficient lithium-ion conduction","N/A","N/A","Ananta Dey, Vishwakarma Ravikumar Ramlal, Selvasundarasekar Sam Sankar, Subrata Kundu, Amal Kumar Mandal, Amitava Das","","","N/A","Success"
"10.1039/D2SC03097G","Topology- and wavelength-governed CO2 reduction photocatalysis in molecular catalyst-metal–organic framework assemblies","N/A","N/A","Philip M. Stanley, Karina Hemmer, Markus Hegelmann, Annika Schulz, Mihyun Park, Martin Elsner, Mirza Cokoja, Julien Warnan","","","N/A","Success"
"10.1039/D0SC05251E","BonDNet: a graph neural network for the prediction of bond dissociation energies for charged molecules","N/A","N/A","Mingjian Wen, Samuel M. Blau, Evan Walter Clark Spotte‐Smith, Shyam Dwaraknath, Kristin A. Persson","","","N/A","Success"
"10.1039/D4SC03527E","Two- and three-photon processes during photopolymerization in 3D laser printing","This study explores the mechanisms of photoactivation and radical formation during 3D laser printing using photoresists with a DETC photoinitiator. The role of DETC in high triplet states during radical polymerization is revealed.","Chemical Science","Anna Mauri, Pascal Kiefer, Philipp Neidinger, Tobias Messer, N. Maximilian Bojanowski, Liang Yang, Sarah Walden, Andreas-Neil Unterreiner, Christopher Barner-Kowollik, Martin Wegener, Wolfgang Wenzel, Mariana Kozlowska","","N/A","N/A","Already Complete"
"10.1039/D1SC06038D","Direct synthesis and applications of solid silylzinc reagents","N/A","N/A","Revathi Chandrasekaran, Feba Thomas Pulikkottil, Krishna Suresh Elama, Ramesh Rasappan","","","N/A","Success"
"10.1039/D3SC01720F","A porphyrin-based molecular cage guided by designed local-electric field is highly selective and efficient","N/A","N/A","Shakir Ali Siddiqui, Sason Shaik, Surajit Kalita, Kshatresh Dutta Dubey","","","N/A","Success"
"10.1039/D3SC02144K","Promoting water formation in sulphate-functionalized Ru for efficient hydrogen oxidation reaction under alkaline electrolytes","N/A","N/A","Chaoyi Yang, Yunbo Li, jianchao Yue, Hengjiang Cong, Wei Luo","","","N/A","Success"
"10.1039/D1SC04283A","Galbofloxacin: a xenometal-antibiotic with potent in vitro and in vivo efficacy against S. aureus","N/A","N/A","Apurva Pandey, Dariusz Śmiłowicz, Eszter Boros","","","N/A","Success"
"10.1039/D3SC02077K","Insights into the synthesis of NHC-stabilized Au nanoclusters through real-time reaction monitoring","N/A","N/A","Junliang Liu, Yusuke Sato, Viveka K. Kulkarni, Angus I. Sullivan, Wenyu Zhang, Cathleen M. Crudden, Jason E. Hein","","","N/A","Success"
"10.1039/D3SC01762A","Photophysical studies for Cu(i)-based halides: broad excitation bands and highly efficient single-component warm white-light-emitting diodes","N/A","N/A","Shuigen Zhou, Yihao Chen, Kailei Li, Xiaowei Liu, Ting Zhang, Wei Shen, Ming Li, Lei Zhou, Rongxing He","","","N/A","Success"
"10.1039/D1SC01113H","Direct CO2 capture and conversion to fuels on magnesium nanoparticles under ambient conditions simply using water","N/A","N/A","Sushma A. Rawool, Rajesh Belgamwar, Rajkumar Jana, Ayan Maity, Ankit Bhumla, Nevzat Yigit, Ayan Datta, Günther Rupprechter, Vivek Polshettiwar","","","N/A","Success"
"10.1039/D4SC01986E","Tricyclononenes and tricyclononadienes as efficient monomers for controlled ROMP: understanding structure–propagation rate relationships and enabling facile post-polymerization modification","N/A","N/A","Landon J. Kilgallon, Timothy Patrick McFadden, Matthew S. Sigman, Jeremiah A. Johnson","","","N/A","Success"
"10.1039/D1SC03725K","A vanadium-based oxide-phosphate-pyrophosphate framework as a 4 V electrode material for K-ion batteries","N/A","N/A","Mirai Ohara, A. Shahul Hameed, Kei Kubota, Akihiro Katogi, Kuniko Chihara, Tomooki Hosaka, Shinichi Komaba","","","N/A","Success"
"10.1039/D4SC00105B","Machine learning demonstrates the impact of proton transfer and solvent dynamics on CO2 capture in liquid ammonia","N/A","N/A","Marcos F. Calegari Andrade, Sichi Li, Tuan Anh Pham, Sneha A. Akhade, Simon H. Pang","","","N/A","Success"
"10.1039/D2SC05802B","Dynamic charge collecting mechanisms of cobalt phosphate on hematite photoanodes studied by photoinduced absorption spectroscopy","N/A","N/A","Dongfeng Li, Ruifang Wei, Heng Yin, Hemin Zhang, Xiuli Wang, Can Li","","","N/A","Success"
"10.1039/D1SC04531H","Water-stable hydrazone-linked porous organic cages","N/A","N/A","Miao Yang, Fenglei Qiu, El-Sayed M. El-Sayed, Wenjing Wang, Shunfu Du, Kongzhao Su, Daqiang Yuan","","","N/A","Success"
"10.1039/D1SC03834F","Uncovering an oxide ion substitution for the OH− + CH3F reaction","N/A","N/A","Domonkos A. Tasi, Gábor Czakó","","","N/A","Success"
"10.1039/D4SC03968H","Mechanochemical generation of aryne","N/A","N/A","Qianqian Cheng, Guillaume De Bo","","","N/A","Success"
"10.1039/D1SC07120C","A site-differentiated [4Fe–4S] cluster controls electron transfer reactivity of Clostridium acetobutylicum [FeFe]-hydrogenase I","N/A","N/A","Carolyn E. Lubner, Jacob H. Artz, David W. Mulder, Aisha Oza, Rachel J. Ward, S. Garrett Williams, Anne K. Jones, John W. Peters, Ivan I. Smalyukh, Vivek S. Bharadwaj, Paul W. King","","","N/A","Success"
"10.1039/D3SC06912E","The pressure response of Jahn-Teller distorted Prussian blue analogues","N/A","N/A","Hanna L. B. Boström, Andrew B. Cairns, Muzi Chen, Dominik Daisenberger, Christopher J. Ridley, Nicholas P. Funnell","","","N/A","Success"
"10.1039/D4SC02499K","Pathway-dependent supramolecular polymerization by planarity breaking","N/A","N/A","Rasitha Manha Veedu, Zulema Fernández, Nils Bäumer, Ana Paula Fonseca Albers, Gustavo Fernández","","","N/A","Success"
"10.1039/D2SC00769J","Reversible tuning of luminescence and magnetism in a structurally flexible erbium–anilato MOF","N/A","N/A","Noemi Monni, José J. Baldoví, Víctor García‐López, Mariangela Oggianu, Enzo Cadoni, Francesco Quochi, Miguel Clemente‐León, Maria Laura Mercuri, Eugenio Coronado","","","N/A","Success"
"10.1039/D2SC03856K","Orientational self-sorting in cuboctahedral Pd cages","N/A","N/A","Ru‐Jin Li, Andrew Tarzia, Víctor Posligua, Kim E. Jelfs, Nicolas Sanchez, Adam W. Marcus, Ananya Baksi, Guido H. Clever, Farzaneh Fadaei‐Tirani, Kay Severin","","","N/A","Success"
"10.1039/D1SC05022B","Shape-shifting thermoreversible diblock copolymer nano-objects via RAFT aqueous dispersion polymerization of 4-hydroxybutyl acrylate","N/A","N/A","Oliver J. Deane, James Jennings, Steven P. Armes","","","N/A","Success"
"10.1039/D2SC06816H","Experimental and theoretical elucidation of SPAAC kinetics for strained alkyne-containing cycloparaphenylenes","N/A","N/A","Julia M. Fehr, Nathalie Myrthil, Anna L. Garrison, Tavis W. Price, Steven A. Lopez, Ramesh Jasti","","","N/A","Success"
"10.1039/D1SC02690A","Construction of isostructural hydrogen-bonded organic frameworks: limitations and possibilities of pore expansion","N/A","N/A","Yuto Suzuki, Mario Gutiérrez, Senri Tanaka, Eduardo Gomez, Norimitsu Tohnai, Nobuhiro Yasuda, Nobuyuki Matubayasi, Abderrazzak Douhal, Ichiro Hisaki","","","N/A","Success"
"10.1039/D0SC04889E","A photo-sensitizable phage for multidrug-resistant Acinetobacter baumannii therapy and biofilm ablation","N/A","N/A","Bei Ran, Yuyu Yuan, Wenxi Xia, Mingle Li, Qichao Yao, Zuokai Wang, Lili Wang, Xiaoyu Li, Yongping Xu, Xiaojun Peng","","","N/A","Success"
"10.1039/D1SC05663H","Linking metal–organic cages pairwise as a design approach for assembling multivariate crystalline materials","N/A","N/A","Adrian W. Markwell‐Heys, Michael Roemelt, Ashley D. Slattery, Oliver M. Linder‐Patton, Witold M. Bloch","","","N/A","Success"
"10.1039/D0SC02313B","Photochemical generation of acyl and carbamoyl radicals using a nucleophilic organic catalyst: applications and mechanism thereof","N/A","N/A","Eduardo de Pedro Beato, Daniele Mazzarella, Matteo Balletti, Paolo Melchiorre","","","N/A","Success"
"10.1039/D0SC00738B","Transforming colloidal Cs4PbBr6 nanocrystals with poly(maleic anhydride-alt-1-octadecene) into stable CsPbBr3 perovskite emitters through intermediate heterostructures","N/A","N/A","Dmitry Baranov, Gianvito Caputo, Luca Goldoni, Zhiya Dang, Riccardo Scarfiello, Luca De Trizio, Alberto Portone, Filippo Fabbri, Andrea Camposeo, Dario Pisignano, Liberato Manna","","","N/A","Success"
"10.1039/D0SC05897A","Effects of turn-structure on folding and entanglement in artificial molecular overhand knots","N/A","N/A","Yiwei Song, Fredrik Schaufelberger, Zoe Ashbridge, Lucian Pirvu, Íñigo J. Vitórica‐Yrezábal, David A. Leigh","","","N/A","Success"
"10.1039/D1SC06060K","Solid-state 17O NMR study of α-d-glucose: exploring new frontiers in isotopic labeling, sensitivity enhancement, and NMR crystallography","N/A","N/A","Jiahui Shen, Victor V. Terskikh, Jochem Struppe, Alia Hassan, Martine Monette, Ivan Hung, Zhehong Gan, Andreas Brinkmann, Gang Wu","","","N/A","Success"
"10.1039/D3SC01734F","Probing collective terahertz vibrations of a hydrogen-bonded water network at buried electrochemical interfaces","N/A","N/A","Taichi Isogai, Masayuki Uranagase, Kenta Motobayashi, Shūji Ogata, Katsuyoshi Ikeda","","","N/A","Success"
"10.1039/D2SC06116C","Discovery of lipid-mediated protein–protein interactions in living cells using metabolic labeling with photoactivatable clickable probes","N/A","N/A","Roman O. Fedoryshchak, Andrii Gorelik, Meng-Jie Shen, Maria M. Shchepinova, Inmaculada Pérez‐Dorado, Edward W. Tate","","","N/A","Success"
"10.1039/D1SC04687J","Enantioselective palladaelectro-catalyzed C–H olefinations and allylations for N–C axial chirality","N/A","N/A","Uttam Dhawa, Tomasz Wdowik, Xiaoyan Hou, Binbin Yuan, João C. A. Oliveira, Lutz Ackermann","","","N/A","Success"
"10.1039/D1SC05504F","A facile and scalable synthetic method for covalent organic nanosheets: ultrasonic polycondensation and photocatalytic degradation of organic pollutants","N/A","N/A","Shi‐Xian Gan, Chao Jia, Qiao-Yan Qi, Xin Zhao","","","N/A","Success"
"10.1039/D1SC06596C","Selective covalent targeting of SARS-CoV-2 main protease by enantiopure chlorofluoroacetamide","N/A","N/A","Daiki Yamane, Satsuki Onitsuka, Suyong Re, Hikaru Isogai, Rui Hamada, Tadanari Hiramoto, Eiji Kawanishi, Kenji Mizuguchi, Naoya Shindo, Akio Ojida","","","N/A","Success"
"10.1039/D4SC00995A","Development of an inhibitor of the mutagenic SOS response that suppresses the evolution of quinolone antibiotic resistance","N/A","N/A","Jane Bradbury, Jane Bradbury, Adam Thomas, A. E. Thomas, Gabriele La Monica, Gabriele La Monica, Luke J. Mackay, Eric Taylor, Keith Gilbert, Yihua Zhu, Armine Sefton, Andrew M. Edwards, Charlotte J. Gray-Hammerton, Gerald R. Smith, Paul M. Roberts, Timothy R. Walsh, Thomas Lanyon‐Hogg","","","N/A","Success"
"10.1039/D1SC05360D","Asymmetric synthesis of N–N axially chiral compounds via organocatalytic atroposelective N-acylation","N/A","N/A","Wei Lin, Qun Zhao, Yao Li, Ming Pan, Chen Yang, Guo-Hui Yang, Xin Li","","","N/A","Success"
"10.1039/D2SC01363K","A practical and sustainable two-component Minisci alkylation via photo-induced EDA-complex activation","N/A","N/A","Mohammed Sharique, Jadab Majhi, Roshan K. Dhungana, Lisa Marie Kammer, Matthias Krumb, Alexander Lipp, Eugénie Romero, Gary A. Molander","","","N/A","Success"
"10.1039/D4SC01625D","Maleimide Functionalized Polycaprolactone Micelles for Glutathione Quenching and Doxorubicin Delivery","N/A","N/A","Godwin K. Babanyinah, Abhi Bhadran, Himanshu Polara, Hanghang Wang, Tejas Shah, Michael C. Biewer, Mihaela C. Stefan","","","N/A","Success"
"10.1039/D1SC02711E","Adapting decarbonylation chemistry for the development of prodrugs capable of in vivo delivery of carbon monoxide utilizing sweeteners as carrier molecules","N/A","N/A","Ladie Kimberly De La Cruz, Xiaoxiao Yang, Anna Menshikh, Maya Brewer, Wen Lu, Minjia Wang, Siming Wang, Xingyue Ji, Alyssa Cachuela, Haichun Yang, David Gallo, Chalet Tan, Leo E. Otterbein, Mark de Caestecker, Binghe Wang","","","N/A","Success"
"10.1039/D2SC07078B","Triarylamines as catalytic donors in light-mediated electron donor–acceptor complexes","N/A","N/A","Durbis J. Castillo-Pazos, Juan D. Lasso, Ehsan Hamzehpoor, Jorge Ramos-Sánchez, Jan Michael Salgado, Gonzalo Cosa, Dmitrii F. Perepichka, Chao‐Jun Li","","","N/A","Success"
"10.1039/D0SC06851A","Soluble, crystalline, and thermally stable alkali CO2− and carbonite (CO22−) clusters supported by cyclic(alkyl)(amino) carbenes","N/A","N/A","Lucas A. Freeman, D. Akachukwu, Haleigh R. Machost, Andrew Molino, Asa W. Nichols, Diane A. Dickie, David J. D. Wilson, Charles W. Machan, Robert J. Gilliard","","","N/A","Success"
"10.1039/D3SC00858D","Modulation of supramolecular chirality by stepwise axial coordination in a nano-size trizinc(ii)porphyrin trimer","N/A","N/A","Avinash Dhamija, Dolly Chandel, Sankar Prasad Rath","","","N/A","Success"
"10.1039/D1SC05113J","Ligand-field transition-induced C–S bond formation from nickelacycles","N/A","N/A","Jeongcheol Shin, Jiseon Lee, Jong‐Min Suh, Kiyoung Park","","","N/A","Success"
"10.1039/D3SC06734C","A scalable synthesis of adjuvanting antigen depots based on metal–organic frameworks","N/A","N/A","Ryanne N. Ehrman, Olivia R. Brohlin, Yalini H. Wijesundara, Sneha Kumari, Orikeda Trashi, Thomas S. Howlett, Ikeda Trashi, Fabian C. Herbert, Arun Raja, Shailendra Koirala, Nancy Tran, Noora M. Al‐Kharji, Wendy Tang, Milinda C. Senarathna, Laurel M. Hagge, Ronald A. Smaldone, Jeremiah J. Gassensmith","","","N/A","Success"
"10.1039/D0SC02212H","Molecular chirality mediated amyloid formation on phospholipid surfaces","N/A","N/A","Xue Wang, Cunli Wang, Huiying Chu, Haijuan Qin, Dongdong Wang, Feifei Xu, Xuanjun Ai, Chunshan Quan, Guohui Li, Guangyan Qing","","","N/A","Success"
"10.1039/D1SC01217G","Phosphite mediated asymmetric N to C migration for the synthesis of chiral heterocycles from primary amines","N/A","N/A","Soniya Rani, Soumya Ranjan Dash, Asish Bera, Md Nirshad Alam, Kumar Vanka, Pradip Maity","","","N/A","Success"
"10.1039/D2SC05784K","Rational design of mesoporous chiral MOFs as reactive pockets in nanochannels for enzyme-free identification of monosaccharide enantiomers","N/A","N/A","Junli Guo, Xuao Liu, Junjian Zhao, Huijie Xu, Zhida Gao, Zeng‐Qiang Wu, Yan‐Yan Song","","","N/A","Success"
"10.1039/D1SC01360B","Evaluation of fully-functionalized diazirine tags for chemical proteomic applications","N/A","N/A","Louis P. Conway, Appaso Mahadev Jadhav, Rick A. Homan, Weichao Li, Juanita Sanchez Rubiano, Richard L. Hawkins, R. Michael Lawrence, Christopher G. Parker","","","N/A","Success"
"10.1039/D0SC04297H","Enhancing glycan stability via site-selective fluorination: modulating substrate orientation by molecular design","N/A","N/A","Alexander Axer, Ravindra P. Jumde, Sebastian Adam, Andreas Faust, Michael Schäfers, Manfred Fobker, Jesko Koehnke, Anna K. H. Hirsch, Ryan Gilmour","","","N/A","Success"
"10.1039/D3SC03317A","Ultra-fast synthesis of three-dimensional porous Cu/Zn heterostructures for enhanced carbon dioxide electroreduction","N/A","N/A","Shuaiqiang Jia, Qinggong Zhu, Shitao Han, Jianxin Zhai, Mengke Dong, Wei Xia, Xueqing Xing, Haihong Wu, Mingyuan He, Buxing Han","","","N/A","Success"
"10.1039/D1SC06326J","Versatile post-functionalisation strategy for the formation of modular organic–inorganic polyoxometalate hybrids","N/A","N/A","David E. Salazar Marcano, Mhamad Aly Moussawi, Alexander V. Anyushin, Sarah Lentink, Luc Van Meervelt, Ivana Ivanović‐Burmazović, Tatjana N. Parac‐Vogt","","","N/A","Success"
"10.1039/D2SC01156E","Variable control of the electronic states of a silver nanocluster via protonation/deprotonation of polyoxometalate ligands","N/A","N/A","Kentaro Yonesato, Seiji Yamazoe, Soichi Kikkawa, Daisuke Yokogawa, Kazuya Yamaguchi, Kosuke Suzuki","","","N/A","Success"
"10.1039/D1SC04261K","Ligand-redox assisted nickel catalysis toward stereoselective synthesis of (n+1)-membered cycloalkanes from 1,n-diols with methyl ketones","N/A","N/A","Amreen K. Bains, Abhishek Kundu, Debabrata Maiti, Debashis Adhikari","","","N/A","Success"
"10.1039/D2SC01821G","Silicon functionalization expands the repertoire of Si-rhodamine fluorescent probes","N/A","N/A","Desaboini Nageswara Rao, Xincai Ji, Stephen C. Miller","","","N/A","Success"
"10.1039/D3SC03342B","Kinetics of ligand exchange in solution: a quantitative mass spectrometry approach","N/A","N/A","Quentin Duez, Paul Tinnemans, Johannes A. A. W. Elemans, Jana Roithová","","","N/A","Success"
"10.1039/D2SC05928B","Regioselectivity of concerted proton–electron transfer at the surface of a polyoxovanadate cluster","N/A","N/A","Eric Schreiber, William W. Brennessel, Ellen M. Matson","","","N/A","Success"
"10.1039/D2SC04210J","Open-air green-light-driven ATRP enabled by dual photoredox/copper catalysis","N/A","N/A","Grzegorz Szczepaniak, Jaepil Jeong, Kriti Kapil, Sajjad Dadashi‐Silab, Saigopalakrishna S. Yerneni, Paulina Ratajczyk, Sushil Lathwal, Dirk J. Schild, Luda S. Shlyakhtenko, Krzysztof Matyjaszewski","","","N/A","Success"
"10.1039/D3SC01458D","How do donor and acceptor substituents change the photophysical and photochemical behavior of dithienylethenes? The search for a water-soluble visible-light photoswitch","N/A","N/A","Sili Qiu, Andrew T. Frawley, Kathryn G. Leslie, Harry L. Anderson","","","N/A","Success"
"10.1039/D4SC00174E","A post-synthetic modification strategy for enhancing Pt adsorption efficiency in MOF/polymer composites","N/A","N/A","Till Schertenleib, Vikram V. Karve, Dragos Stoian, Mehrdad Asgari, Olga Trukhina, Emad Oveisi, Mounir Mensi, Wendy L. Queen","","","N/A","Success"
"10.1039/D3SC03528J","Directing group assisted para-selective C–H alkynylation of unbiased arenes enabled by rhodium catalysis","N/A","N/A","Uttam Dutta, Gaurav Prakash, Kirti Devi, Kongkona Borah, Xinglong Zhang, Debabrata Maiti","","","N/A","Success"
"10.1039/D4SC03504F","Stereogenic-at-iron mesoionic carbene complex for enantioselective C–H amidation","Stereogenic-at-iron complexes, featuring strongly σ-donating mesoionic carbene (MIC) ligands, exhibit enhanced catalytic efficiency compared to their normal N-heterocyclic carbene congeners in nitrene-mediated ring-closing C(sp3)–H amidations.","Chemical Science","Nemrud Demirel, Mahiob Dawor, Greta Nadler, Sergei I. Ivlev, Eric Meggers","","N/A","N/A","Already Complete"
"10.1039/D1SC06115A","Stereodivergent synthesis via iridium-catalyzed asymmetric double allylic alkylation of cyanoacetate","N/A","N/A","Chong Shen, Xiang Cheng, Liang Wei, Ruo‐Qing Wang, Chun‐Jiang Wang","","","N/A","Success"
"10.1039/D0SC05131D","Discovery of cryptic allosteric sites using reversed allosteric communication by a combined computational and experimental strategy","N/A","N/A","Duan Ni, Jiacheng Wei, Xinheng He, Ashfaq Ur Rehman, Xinyi Li, Yuran Qiu, Jun Pu, Shaoyong Lu, Jian Zhang","","","N/A","Success"
"10.1039/D3SC03303A","A copper(ii) peptide helicate selectively cleaves DNA replication foci in mammalian cells","N/A","N/A","Ana Alcalde-Ordóñez, Natalia Barreiro-Piñeiro, Bríonna McGorman, Jacobo Gómez‐González, David Bouzada, F. Rivadulla, M. Eugenio Vázquez, Andrew Kellett, José Martínez‐Costas, E.M. Vázquez-López","","","N/A","Success"
"10.1039/D1SC07203J","Controlling the lifetime of cucurbit[8]uril based self-abolishing nanozymes","N/A","N/A","Saurav Das, Tanushree Das, Priyam Das, Debapratim Das","","","N/A","Success"
"10.1039/D3SC01161E","PET recycling under mild conditions via substituent-modulated intramolecular hydrolysis","N/A","N/A","Shengbo Zhang, Yingying Xue, Yanfen Wu, Yu‐Xiao Zhang, Ting Tan, Zhiqiang Niu","","","N/A","Success"
"10.1039/D2SC05198B","Cobalt-electrocatalytic C–H hydroxyalkylation ofN-heteroarenes with trifluoromethyl ketones","N/A","N/A","Tianyu He, Chaoqiang Liang, Shenlin Huang","","","N/A","Success"
"10.1039/D2SC00393G","Detection of multi-reference character imbalances enables a transfer learning approach for virtual high throughput screening with coupled cluster accuracy at DFT cost","N/A","N/A","Chenru Duan, Daniel B. K. Chu, Aditya Nandy, Heather J. Kulik","","","N/A","Success"
"10.1039/D4SC03338H","Intensified electrochemiluminescence and photoluminescence via supramolecular anion recognition interactions","N/A","N/A","Jun Kee Cheng, Liuqing Yang, Ruiyao Wang, James A. Wisner, Zhifeng Ding, Hongbo Wang","","","N/A","Success"
"10.1039/D2SC06089B","Individually separated supramolecular polymer chains toward solution-processable supramolecular polymeric materials","N/A","N/A","Takuma Shimada, Yuichiro Watanabe, Takashi Kajitani, Masayuki Takeuchi, Yutaka Wakayama, Kazunori Sugiyasu","","","N/A","Success"
"10.1039/D2SC02997A","Nitrogen activation and cleavage by a multimetallic uranium complex","N/A","N/A","Megan Keener, Farzaneh Fadaei‐Tirani, Rosario Scopelliti, Ivica Živković, Marinella Mazzanti","","","N/A","Success"
"10.1039/D4SC01078G","A pair of conjoined trinuclear sub-frameworks in a pentanuclear double-cavity discrete coordination cage","N/A","N/A","Shruti Sharma, Shobhana Krishnaswamy, Soumyakanta Prusty, Dillip Kumar Chand","","","N/A","Success"
"10.1039/D1SC03680G","A pillar[5]arene-based covalent organic framework with pre-encoded selective host–guest recognition","N/A","N/A","Lu Liu, Yiming Hu, Shaofeng Huang, Yinghua Jin, Jingnan Cui, Weitao Gong, Wei Zhang","","","N/A","Success"
"10.1039/D2SC05794H","Transmitting biomolecular chirality into carbon nanodots: a facile approach to acquire chiral light emission at the nanoscale","N/A","N/A","Sonia Maniappan, Kumbam Lingeshwar Reddy, Jatish Kumar","","","N/A","Success"
"10.1039/D0SC05602B","Electrical conductivity in a non-covalent two-dimensional porous organic material with high crystallinity","N/A","N/A","Qizhi Xu, Boyuan Zhang, Yihang Zeng, Amirali Zangiabadi, Hongwei Ni, Rongsheng Chen, Fay Ng, Michael L. Steigerwald, Colin Nuckolls","","","N/A","Success"
"10.1039/D2SC00459C","A dynamic DNA nanosponge for triggered amplification of gene-photodynamic modulation","N/A","N/A","Dan Luo, Xue Lin, Yun Zhao, Jialing Hu, Fengye Mo, Gege Song, Zhiqiao Zou, Fuan Wang, Xiaoqing Liu","","","N/A","Success"
"10.1039/D1SC04503B","Facile conversion of ammonia to a nitride in a rhenium system that cleaves dinitrogen","N/A","N/A","Gannon P. Connor, Daniel Delony, Jeremy E. Weber, Brandon Q. Mercado, Julia B. Curley, Sven Schneider, James M. Mayer, Patrick L. Holland","","","N/A","Success"
"10.1039/D4SC05419A","Structural and solvent modulation of symmetry-breaking charge-transfer pathways in molecular triads","N/A","N/A","Chinju Govind, Evangelos Balanikas, Gana Sanil, Daniel T. Gryko, Eric Vauthey","","","N/A","Success"
"10.1039/D0SC04051G","Inhibitor and substrate cooperate to inhibit amyloid fibril elongation of α-synuclein","N/A","N/A","Emil Dandanell Agerschou, Vera Borgmann, Michael M. Wördehoff, Wolfgang Hoyer","","","N/A","Success"
"10.1039/D3SC04269C","Borylation directed borylation of N-alkyl anilines using iodine activated pyrazaboles","N/A","N/A","Clément R. P. Millet, Emily Noone, A. V. Schellbach, Jürgen Pahl, Justyna Łosiewicz, Gary S. Nichol, Michael J. Ingleson","","","N/A","Success"
"10.1039/D0SC01701A","trans-Hydroboration–oxidation products in Δ5-steroids via a hydroboration-retro-hydroboration mechanism","N/A","N/A","J. Ciciolil Hilario-Martínez, Fernando Murillo, Jair García-Méndez, Eugenia Dzib, Jesús Sandoval‐Ramírez, Miguel‐Ángel Muñoz‐Hernández, S. Bernès, László Kürti, Fernanda Duarte, Gabriel Merino, María A. Fernández‐Herrera","","","N/A","Success"
"10.1039/D3SC05941C","Controlling Aggregation-Induced Emission by Supramolecular Interactions and Colloidal Stability in Ionic Emitters for Light-Emitting Electrochemical Cells","N/A","N/A","Alba Sanz-Velasco, Olivia Amargós‐Reyes, Aya Kähäri, Sophia Lipinski, Luca M. Cavinato, Rubén D. Costa, Mauri A. Kostiainen, Eduardo Anaya‐Plaza","","","N/A","Success"
"10.1039/D3SC03732K","Acid–base responsive multifunctional poly(formyl sulfide)s through a facile catalyst-free click polymerization of aldehyde-activated internal diynes and dithiols","N/A","N/A","Baixue Li, Xue Wang, Die Huang, Mingzhao Li, Anjun Qin, Yusheng Qin, Ben Zhong Tang","","","N/A","Success"
