"DOI","Title","Abstract","Journal","Authors","Keywords","Institute of Origin","Funding","Enrichment Status"
"10.1039/D4SC05369A","Exploring Efficient and Air-Stable d2 Re(V) Alkylidyne Catalysts: Toward Room Temperature Alkyne Metathesis","N/A","N/A","Mingxu Cui, Jie Huang, Long Yiu Tsang, Herman H‐Y. Sung, Ian D. Williams, Guochen Jia","","","N/A","Success"
"10.1039/D1SC03007H","Highly efficient on-DNA amide couplings promoted by micelle forming surfactants for the synthesis of DNA encoded libraries","N/A","N/A","James H. Hunter, Matthew J. Anderson, Isaline F. S. F. Castan, Jessica S. Graham, Catherine L. A. Salvini, Harriet A. Stanway‐Gordon, James J. Crawford, Andrew Madin, Garry Pairaudeau, Michael J. Waring","","","N/A","Success"
"10.1039/D2SC00345G","Structural and dynamical determinants of a β-sheet-enriched intermediate involved in amyloid fibrillar assembly of human prion protein","N/A","N/A","Massimiliano Galdiero, Giulia Salzano, Andrea Corvino, Edoardo Bistaffa, Fabio Moda, Luigi Celauro, Gianluca D’Abrosca, Carla Isernia, Danilo Milardi, Gabriele Giachin, Gaetano Malgieri, Giuseppe Legname, Roberto Fattorusso","","","N/A","Success"
"10.1039/D3SC01927F","Gaining control on optical force by the stimulated-emission resonance effect","N/A","N/A","Tetsuhiro Kudo, Boris Louis, Hikaru Sotome, Jim Jui‐Kai Chen, Syoji Ito, Hiroshi Miyasaka, Hiroshi Masuhara, Johan Hofkens, Roger Bresolí‐Obach","","","N/A","Success"
"10.1039/D4SC03861D","Single-Molecule Detection of a Terrylenediimide-Based Near-Infrared Emitter","N/A","N/A","Suvarna Sujilkumar, Philip Daniel Maret, Kavya Vinod, A. John, Mahesh Hariharan","","","N/A","Success"
"10.1039/D3SC03991A","Systematic exploration of accessible topologies of cage molecules via minimalistic models","N/A","N/A","Andrew Tarzia, Emma H. Wolpert, Kim E. Jelfs, Giovanni M. Pavan","","","N/A","Success"
"10.1039/D2SC00443G","Photoelectrochemical water oxidation improved by pyridine N-oxide as a mimic of tyrosine-Z in photosystem II","N/A","N/A","Yong Zhu, Guoquan Liu, Ran Zhao, Hua Gao, Xiaona Li, Licheng Sun, Fei Li","","","N/A","Success"
"10.1039/D1SC02975D","Dissecting the activation of insulin degrading enzyme by inositol pyrophosphates and their bisphosphonate analogs","N/A","N/A","Sarah Hostachy, Tillmann Utesch, Katy Franke, Gillian L. Dornan, David Furkert, Berke Türkaydin, Volker Haucke, Han Sun, Dorothea Fiedler","","","N/A","Success"
"10.1039/D0SC04469E","“Bottled” spiro-doubly aromatic trinuclear [Pd2Ru]+complexes","N/A","N/A","Maksim Kulichenko, Nikita Fedik, Anna Monfredini, Álvaro Muñoz-Castro, Davide Balestri, Alexander I. Boldyrev, Giovanni Maestri","","","N/A","Success"
"10.1039/D3SC05865D","Peptide Macrocyclisation via Intramolecular Interception of Visible-Light-Mediated Desulfurisation","N/A","N/A","Frances R. Smith, Declan Meehan, Rhys C. Griffiths, Harriet Knowles, Peiyu Zhang, Huw E. L. Williams, Andrew J. Wilson, Nicholas J. Mitchell","","","N/A","Success"
"10.1039/D1SC01175H","Efficient and organic host–guest room-temperature phosphorescence: tunable triplet–singlet crossing and theoretical calculations for molecular packing","N/A","N/A","Yunxiang Lei, Jiaxin Yang, Wenbo Dai, Yisha Lan, Jianhui Yang, Xiaoyan Zheng, Jianbing Shi, Bin Tong, Zhengxu Cai, Yuping Dong","","","N/A","Success"
"10.1039/D4SC01300J","4f-Orbital Mixing Increases the Magnetic Susceptibility of Cp′3Eu","N/A","N/A","Sebastian Günther, Yusen Qiao, Patrick W. Smith, Sierra R. Ciccone, Alexander S. Ditter, Daniel N. Huh, Liane M. Moreau, David K. Shuh, Taoxiang Sun, Polly L. Arnold, Corwin H. Booth, Wibe A. de Jong, William J. Evans, Wayne W. Lukens, Stefan G. Minasian","","","N/A","Success"
"10.1039/D1SC01976G","Characterization and chemical reactivity of room-temperature-stable MnIII–alkylperoxo complexes","N/A","N/A","Adedamola A. Opalade, Joshua D. Parham, Victor W. Day, Timothy A. Jackson","","","N/A","Success"
"10.1039/D1SC04139H","Tunable heteroaromatic azoline thioethers (HATs) for cysteine profiling","N/A","N/A","Kuei C. Tang, Sean M. Maddox, Keriann M. Backus, Monika Raj","","","N/A","Success"
"10.1039/D2SC02317B","Perpetuating enzymatically induced spatiotemporal pH and catalytic heterogeneity of a hydrogel by nanoparticles","N/A","N/A","Rishi Ram Mahato, Priyanka Sharma, Ekta Shandilya, Subhabrata Maiti","","","N/A","Success"
"10.1039/D3SC03105E","Understanding the evolution of double perovskite band structure upon dimensional reduction","N/A","N/A","Bridget A. Connor, Alexander C. Su, Adam H. Slavney, Linn Leppert, Hemamala I. Karunadasa","","","N/A","Success"
"10.1039/D3SC01867A","Disulfide radical anion as a super-reductant in biology and photoredox chemistry","N/A","N/A","Qilei Zhu, Cyrille Costentin, JoAnne Stubbe, Daniel G. Nocera","","","N/A","Success"
"10.1039/D3SC03133K","Dynamic self-assembly of supramolecular catalysts from precision macromolecules","N/A","N/A","Qian Qin, Jie Li, David Dellemme, Mathieu Fossépré, Gabriella Barozzino‐Consiglio, Imane Nekkaa, Adrian Boborodea, Antony E. Fernandes, Karine Glinel, Mathieu Surin, Alain M. Jonas","","","N/A","Success"
"10.1039/D0SC04263C","One class classification as a practical approach for accelerating π–π co-crystal discovery","N/A","N/A","Aikaterini Vriza, Angelos B. Canaj, Rebecca Vismara, Laurence J. Kershaw Cook, Troy D. Manning, Michael W. Gaultois, P.A. Wood, Vitaliy Kurlin, Neil G. Berry, Matthew S. Dyer, Matthew J. Rosseinsky","","","N/A","Success"
"10.1039/D1SC06122D","Electro-oxidation of amino-functionalized multiwalled carbon nanotubes","N/A","N/A","Yuanyuan Lu, Xiuting Li, Richard G. Compton","","","N/A","Success"
"10.1039/D3SC03090C","A visible-light-driven molecular motor based on barbituric acid","N/A","N/A","Kim Kuntze, Daisy R. S. Pooler, Mariangela Di Donato, Michiel Hilbers, Pieter van der Meulen, Wybren Jan Buma, Arri Priimägi, Ben L. Feringa, Stefano Crespi","","","N/A","Success"
"10.1039/D3SC02345A","Salt-stabilized alkylzinc pivalates: versatile reagents for cobalt-catalyzed selective 1,2-dialkylation","N/A","N/A","Jie Lin, Kaixin Chen, Jixin Wang, Jiawei Guo, Siheng Dai, Ying Hu, Jie Li","","","N/A","Success"
"10.1039/D3SC00500C","In vivo biocompatibility of ZIF-8 for slow release via intranasal administration","N/A","N/A","Sneha Kumari, Thomas S. Howlett, Ryanne N. Ehrman, Shailendra Koirala, Orikeda Trashi, Ikeda Trashi, Yalini H. Wijesundara, Jeremiah J. Gassensmith","","","N/A","Success"
"10.1039/D4SC04619F","Facile and scale-up syntheses of high-performance enzyme@meso-HOF biocatalysts","Facile and scale-up fabrication of enzyme-loaded mesoporous hydrogen-bonded organic frameworks as efficient biocatalysts is achieved.","Chemical Science","Zhengyi Di, Yu Qi, Xin-Xin Yu, Hai-Ruo Li, Meng-Xuan Zuo, Tian-Tian Ren, Cheng-Peng Li, Yanli Zhao","","N/A","N/A","Already Complete"
"10.1039/D4SC04034A","Phospha-bicyclohexene-germylenes exhibiting unexpected reactivity","N/A","N/A","Marie S. Würdemann, Stephen J. Kuhn, Tobias Bötel, Marc Schmidtmann, Thomas Müller","","","N/A","Success"
"10.1039/D0SC05447J","Inhibitors of thiol-mediated uptake","N/A","N/A","Yangyang Cheng, Anh‐Tuan Pham, Takehiro Kato, Bumhee Lim, Dimitri Moreau, Javier López‐Andarias, Lili Zong, Naomi Sakai, Stefan Matile","","","N/A","Success"
"10.1039/D1SC00482D","Reaction-based machine learning representations for predicting the enantioselectivity of organocatalysts","N/A","N/A","Simone Gallarati, Raimón Fabregat, Rubén Laplaza, Sinjini Bhattacharjee, Matthew D. Wodrich, Clémence Corminbœuf","","","N/A","Success"
"10.1039/D1SC01571K","Direct amidation of metallaaromatics: access to N-functionalized osmapentalynes via a 1,5-bromoamidated intermediate","N/A","N/A","Hongjian Wang, Yonghong Ruan, Yu‐Mei Lin, Haiping Xia","","","N/A","Success"
"10.1039/D3SC02913A","Hydrogen spillover and substrate–support hydrogen bonding mediate hydrogenation of phenol catalyzed by palladium on reducible metal oxides","N/A","N/A","Yeongseo An, Puranjan Chatterjee, Pranjali Naik, sayak Banerjee, Wenyu Huang, Igor I. Slowing, Vincenzo Venditti","","","N/A","Success"
"10.1039/D4SC03528C","Reaction Acceleration at the Surface of a Levitated Droplet by Vapor Dosing from a Partner Droplet","N/A","N/A","Lingqi Qiu, Xi-Lai Li, Dylan T. Holden, R. Graham Cooks","","","N/A","Success"
"10.1039/D4SC05018E","Exclusive catalytic hydrogenation of nitrobenzene toward p-aminophenol over atomically precise Au36(SR)24 clusters","N/A","N/A","Jinzhi Lu, Jiaqi Zhang, Guodong Qi, Chao Juan, Jun Xu, Zhen‐Feng Cai, Dan Li, Xiao Cai, Xu Liu, Mingyang Chen, Weiping Ding, Yan Zhu","","","N/A","Success"
"10.1039/D3SC04165D","Inserting an “atomic trap” for directional dopant migration in core/multi-shell quantum dots","N/A","N/A","Chun Chu, Elan Hofman, Chengpeng Gao, Shuya Li, Hanjie Lin, Walker MacSwain, John M. Franck, Robert W. Meulenberg, Arindam Chakraborty, Weiwei Zheng","","","N/A","Success"
"10.1039/D2SC04661J","Thiazole fused S,N-heteroacene step-ladder polymeric semiconductors for organic transistors","N/A","N/A","Salahuddin Attar, Rui Yang, Zhihui Chen, Xiaozhou Ji, Marc Comí, Sarbajit Banerjee, Lei Fang, Yao Liu, Mohammed Al‐Hashimi","","","N/A","Success"
"10.1039/D4SC00917G","Boosting Charge Separation in Organic Photovoltaics: Unveiling Dipole Moment Variations in Excited Non-Fullerene Acceptor Layers","N/A","N/A","Akira Yamakata, Kosaku Kato, Takumi Urakami, Sota Tsujimura, Kasumi Murayama, Masahiro Higashi, Hirofumi Sato, Yasuhiro Kobori, Tomokazu Umeyama, Hiroshi Imahori","","","N/A","Success"
"10.1039/D1SC01331A","Light-guided intrabodies for on-demand in situ target recognition in human cells","N/A","N/A","Eike F. Joest, Christian Winter, Joshua S. Wesalo, Alexander Deiters, Robert Tampé","","","N/A","Success"
"10.1039/D1SC01717A","Expanding excitation wavelengths for azobenzene photoswitching into the near-infrared range via endothermic triplet energy transfer","N/A","N/A","Jussi Isokuortti, Kim Kuntze, Matti Virkki, Zafar Ahmed, Elina Vuorimaa, Mikhail A. Filatov, Andrey Turshatov, Timo Laaksonen, Arri Priimägi, Nikita A. Durandin","","","N/A","Success"
"10.1039/D3SC06575H","Synthesis of a dendritic cell-targeted self-assembled polymeric nanoparticle for selective delivery of mRNA vaccines to elicit enhanced immune responses","N/A","N/A","Chen‐Yo Fan, Szu‐Wen Wang, Cinya Chung, Jia‐Yan Chen, Chia-Yen Chang, Sheau‐Chiou Chao, Tsui-Ling Hsu, Ting-Jen Rachel Cheng, Chi‐Huey Wong","","","N/A","Success"
"10.1039/D3SC01497E","A nickel-based metal–organic framework as a new cathode for chloride ion batteries with superior cycling stability","N/A","N/A","Qing Yin, Zhihao Song, Shuhan Yang, Li Wang, Yanwei Sui, Jiqiu Qi, Danyang Zhao, Lei Hou, Yong‐Zhi Li","","","N/A","Success"
"10.1039/D1SC06634J","Temperature triggered alternating copolymerization of epoxides and lactones via pre-sequenced spiroorthoester intermediates","N/A","N/A","Hyuk‐Joon Jung, Chatura Goonesinghe, Parisa Mehrkhodavandi","","","N/A","Success"
"10.1039/D0SC00063A","Real-time tracking of the entangled pathways in the multichannel photodissociation of acetaldehyde","N/A","N/A","Chung-Hsin Yang, Surjendu Bhattacharyya, L.H. Liu, Wei‐Hai Fang, Kopin Liu","","","N/A","Success"
"10.1039/D2SC03780G","Interfacial electric fields catalyze Ullmann coupling reactions on gold surfaces","N/A","N/A","Ilana B. Stone, Rachel L. Starr, Norah M. Hoffmann, Xiao Wang, Austin M. Evans, Colin Nuckolls, Tristan H. Lambert, Michael L. Steigerwald, Timothy C. Berkelbach, Xavier Roy, Latha Venkataraman","","","N/A","Success"
"10.1039/D1SC02965G","Chromophore-radical excited state antiferromagnetic exchange controls the sign of photoinduced ground state spin polarization","N/A","N/A","Martin L. Kirk, David A. Shultz, Patrick Hewitt, Daniel E. Stasiw, Ju Chen, Art van der Est","","","N/A","Success"
"10.1039/D1SC02663A","Indirect reduction of CO2and recycling of polymers by manganese-catalyzed transfer hydrogenation of amides, carbamates, urea derivatives, and polyurethanes","N/A","N/A","Xin Liu, Thomas Werner","","","N/A","Success"
"10.1039/D4SC04211E","Retro-Cope elimination of cyclic alkynes: reactivity trends and rational design of next-generation bioorthogonal reagents","Diversify your bonds! The reactivity of preactivated cycloalkynes in the retro-Cope elimination reaction was quantum chemically investigated. Based on our finding, we rationally designed a suite of next-generation reagents.","Chemical Science","Steven E. Beutick, Song Yu, Laura Orian, F. Matthias Bickelhaupt, Trevor A. Hamlin","","N/A","N/A","Already Complete"
"10.1039/D0SC07052A","Chiral Lewis acid-bonded picolinaldehyde enables enantiodivergent carbonyl catalysis in the Mannich/condensation reaction of glycine ester","N/A","N/A","Xia Zhong, Ziwei Zhong, Zhikun Wu, Zhen Ye, Yuxiang Feng, Shunxi Dong, Xiaohua Liu, Qian Peng, Xiaoming Feng","","","N/A","Success"
"10.1039/D3SC04388F","Accessing metal-specific orbital interactions in C–H activation with resonant inelastic X-ray scattering","N/A","N/A","Ambar Banerjee, Raphael M. Jay, Torsten Leitner, Ru‐Pan Wang, Jessica Harich, Robert Stefanuik, Michael R. Coates, Emma V. Beale, Victoria Kabanova, Abdullah Kahraman, Anna Wach, D. Ozerov, Christopher Arrell, Christopher J. Milne, Philip J. M. Johnson, Claudio Cirelli, Camila Bacellar, Nils Huse, Michael Odelius, Philippe Wernet","","","N/A","Success"
"10.1039/D1SC02197D","An amplification-free ultra-sensitive electrochemical CRISPR/Cas biosensor for drug-resistant bacteria detection","N/A","N/A","Akkapol Suea‐Ngam, Philip D. Howes, Andrew J. deMello","","","N/A","Success"
"10.1039/D2SC03909E","Selection of diverse polymorphic structures from a small dynamic molecular network controlled by the environment","N/A","N/A","B. Bartolec, Armin Kiani, Meagan A. Beatty, Meniz Altay, Guillermo Monreal Santiago, Jan B. F. N. Engberts","","","N/A","Success"
"10.1039/D4SC02432J","A general graph neural network based implicit solvation model for organic molecules in water","N/A","N/A","Paul Katzberger, Sereina Riniker","","","N/A","Success"
"10.1039/D1SC04846E","When SF5 outplays CF3: effects of pentafluorosulfanyl decorated scorpionates on copper","N/A","N/A","Anurag Noonikara‐Poyil, Álvaro Muñoz-Castro, Andrii Boretskyi, Pavel K. Mykhailiuk, H. V. Rasika Dias","","","N/A","Success"
"10.1039/D4SC03242J","Unleashing the potential of Li–O2 batteries with electronic modulation and lattice strain in pre-lithiated electrocatalysts","Electronic modulation and lattice strain in pre-lithiated electrocatalysts, lead to optimized Li–O intermediate adsorption and enhanced electron transfer for improved Li–O2 battery performance with high efficiency, longevity, and large capacity.","Chemical Science","Zhengcai Zhang, Dulin Huang, Shuochao Xing, Minghui Li, Jing Wu, Zhang Zhang, Yaying Dou, Zhen Zhou","","N/A","N/A","Already Complete"
"10.1039/D3SC01295F","From closed-shell edge-extended kekulenes to open-shell carbonylated cycloarene diradicaloid","N/A","N/A","Dongdong Chang, Jiangyu Zhu, Yutao Sun, Kai Chi, Yanjun Qiao, Teng Wang, Yan Zhao, Yunqi Liu, Xuefeng Lu","","","N/A","Success"
"10.1039/D1SC01050F","Attention-based generative models for de novo molecular design","N/A","N/A","Orion Dollar, Nisarg Joshi, David A. C. Beck, Jim Pfaendtner","","","N/A","Success"
"10.1039/D3SC04004F","Resolving a guanine-quadruplex structure in the SARS-CoV-2 genome through circular dichroism and multiscale molecular modeling","N/A","N/A","Luisa D’Anna, Tom Miclot, Emmanuelle Bignon, Ugo Perricone, Giampaolo Barone, Antonio Monari, Alessio Terenzi","","","N/A","Success"
"10.1039/D3SC01876H","A conductive catecholate-based framework coordinated with unsaturated bismuth boosts CO2 electroreduction to formate","N/A","N/A","Zengqiang Gao, Man Hou, Yongxia Shi, Li Li, Qisheng Sun, Shuyuan Yang, Zhiqiang Jiang, Wenjuan Yang, Zhicheng Zhang, Wenping Hu","","","N/A","Success"
"10.1039/D2SC00437B","Highly selective synthesis and near-infrared photothermal conversion of metalla-Borromean ring and [2]catenane assemblies","N/A","N/A","Li‐Long Dang, Tingting Li, Tingting Zhang, Ying Zhao, Tian Chen, Xiang Gao, Lu‐Fang Ma, Guo‐Xin Jin","","","N/A","Success"
"10.1039/D4SC03384A","Gradual evolution of a homo-l-peptide world on homo-d-configured RNA and DNA","Nucleic acids with hypermodified nucleosides perform stereoselective RNA/DNA-mediated peptide coupling, followed by thermal release of the peptide, leading to temperature-driven one-pot cycles with gradual homochiral l-peptide enrichment.","Chemical Science","Ewa Węgrzyn, Ivana Mejdrová, Thomas Carell","","N/A","N/A","Already Complete"
"10.1039/D2SC05918E","Practical, scalable, and transition metal-free visible light-induced heteroarylation route to substituted oxindoles","N/A","N/A","Jadab Majhi, Albert Granados, Bianca T. Matsuo, Vittorio Ciccone, Roshan K. Dhungana, Mohammed Sharique, Gary A. Molander","","","N/A","Success"
"10.1039/D3SC00752A","Designing multi-target-directed flavonoids: a strategic approach to Alzheimer's disease","N/A","N/A","Seongmin Park, Mingeun Kim, Yuxi Lin, Mannkyu Hong, Geewoo Nam, Adam Mieczkowski, József Kardos, Young‐Ho Lee, Mi Hee Lim","","","N/A","Success"
"10.1039/D4SC04526B","Surefire generation of stannylpotassium: highly reactive stannyl anions and applications","N/A","N/A","Yuta Hiraoka, Taiki Imagawa, Kazuki Nakanishi, H. KAWABE, Masaaki Nakamoto, Takumi Tsushima, Hiroto Yoshida","","","N/A","Success"
"10.1039/D1SC04666G","Synthesis and electronic structure analysis of the actinide allenylidenes, [{(NR2)3}An(CCCPh2)]− (An = U, Th; R = SiMe3)","N/A","N/A","Greggory T. Kent, Xiaojuan Yu, Guang Wu, Jochen Autschbach, Trevor W. Hayton","","","N/A","Success"
"10.1039/D2SC03460C","Ultrasensitive chemiluminescent neuraminidase probe for rapid screening and identification of small-molecules with antiviral activity against influenza A virus in mammalian cells","N/A","N/A","Omri Shelef, Sara Gutkin, Daniel Feder, Ariel Ben-Bassat, Michal Mandelboim, Yoni Haitin, Nir Ben‐Tal, Eran Bacharach, Doron Shabat","","","N/A","Success"
"10.1039/D4SC02084G","Halo-perfluoroalkoxylation of gem-difluoroalkenes with short-lived alkali metal perfluoroalkoxides in triglyme","N/A","N/A","Koki Kawai, Yoshimitsu Kato, Taichi Araki, Shun-ichi Ikawa, Mai Usui, Naoyuki Hoshiya, Yosuke Kishikawa, Jorge Escorihuela, Norio Shibata","","","N/A","Success"
"10.1039/D4SC03667K","Unraveling Non-Radiative Decay Channels of Exciplexes to Construct Efficient Red Emitters for Organic Light-Emitting Diodes","N/A","N/A","Silu Tao, Qian Zhang, Zhuo Hao, Haoyu Yang, Bo Han, Yonghao Zheng, Hui Huang, Hui Lin, Silu Tao, Caijun Zheng, Xiaohong Zhang","","","N/A","Success"
"10.1039/D3SC00159H","Lipid oxidation controls peptide self-assembly near membranes through a surface attraction mechanism","N/A","N/A","Torsten John, Stefania Piantavigna, Tiara J. A. Dealey, Bernd Abel, Herre Jelger Risselada, Lisandra L. Martin","","","N/A","Success"
"10.1039/D2SC04302E","Uranium(iv) alkyl cations: synthesis, structures, comparison with thorium(iv) analogues, and the influence of arene-coordination on thermal stability and ethylene polymerization activity","N/A","N/A","Nicholas R. Andreychuk, Balamurugan Vidjayacoumar, Jeffrey S. Price, Sophie Kervazo, Craig A. Peeples, David J. H. Emslie, Valérie Vallet, André Severo Pereira Gomes, Florent Réal, Georg Schreckenbach, Paul W. Ayers, Ignacio Vargas‐Baca, Hilary A. Jenkins, James F. Britten","","","N/A","Success"
"10.1039/D4SC02598A","Biomimetic engineering of a neuroinflammation-targeted MOF nanozyme scaffolded with photo-trigger released CO for the treatment of Alzheimer’s disease","N/A","N/A","Chun Liu, Wenting Zhang, Haochen Zhang, Chuanqi Zhao, Xiubo Du, Jinsong Ren, Xiaogang Qu","","","N/A","Success"
"10.1039/D2SC05044G","Controlling the fluorescence quantum yields of benzothiazole-difluoroborates by optimal substitution","N/A","N/A","Patryk Rybczyński, Manon H. E. Bousquet, Anna Kaczmarek–Kędziera, Beata Jędrzejewska, Denis Jacquemin, Borys Ośmiałowski","","","N/A","Success"
"10.1039/D3SC01084H","Solid-state synthesis of cesium manganese halide nanocrystals in glass with bright and broad red emission for white LEDs","N/A","N/A","Guangyong Xu, Chuying Wang, Yacong Li, Meng Wen, Guigen Luo, Min Peng, Bin Xu, Zhengtao Deng","","","N/A","Success"
"10.1039/D2SC03418B","Organocopper(ii) complexes: new catalysts for carbon–carbon bond formation via electrochemical atom transfer radical addition (eATRA)","N/A","N/A","Miguel A. Gonzálvez, Chuyi Su, Craig M. Williams, Paul V. Bernhardt","","","N/A","Success"
"10.1039/D0SC05647B","A chemically consistent graph architecture for massive reaction networks applied to solid-electrolyte interphase formation","N/A","N/A","Samuel M. Blau, Hetal D. Patel, Evan Walter Clark Spotte‐Smith, Xiaowei Xie, Shyam Dwaraknath, Kristin A. Persson","","","N/A","Success"
"10.1039/D2SC04722E","On-surface synthesis of non-benzenoid conjugated polymers by selective atomic rearrangement of ethynylarenes","N/A","N/A","Alejandro Jiménez-Martín, Federico Villalobos, Benjamín Mallada, Shayan Edalatmanesh, Adam Matěj, Juan M. Cuerva, Pavel Jelı́nek, Araceli G. Campaña, Bruno de la Torre","","","N/A","Success"
"10.1039/D3SC05409H","Delocalisation enables efficient charge generation in organic photovoltaics, even with little to no energetic offset","N/A","N/A","Daniel Balzer, Ivan Kassal","","","N/A","Success"
"10.1039/D2SC03833A","Imaging of hypochlorous acid in mitochondria using an asymmetric near-infrared fluorescent probe with large Stokes shift","N/A","N/A","Wei Hu, Taotao Qiang, Chenchen Li, Longfang Ren, Fei Cheng, Baoshuai Wang, Mingli Li, Xinjian Song, Tony D. James","","","N/A","Success"
"10.1039/D1SC06812A","Inducing a pH-dependent conformational response by competitive binding to Zn2+ of a series of chiral ligands of disparate basicity","N/A","N/A","Matthew M. Wootten, Bryden A. F. Le Bailly, Sofja Tshepelevitsh, Ivo Leito, Jonathan Clayden","","","N/A","Success"
"10.1039/D3SC02782A","Discovery of reactive peptide inhibitors of human papillomavirus oncoprotein E6","N/A","N/A","Xiyun Ye, Peiyuan Zhang, Jason Tao, John Wang, Amirhossein Mafi, Nathalie M. Grob, Anthony J. Quartararo, Hannah T. Baddock, Leanne Jade G. Chan, Fiona E. McAllister, Ian T. Foe, Andrei Loas, Dan Eaton, Qi Hao, Aaron H. Nile, Bradley L. Pentelute","","","N/A","Success"
"10.1039/D2SC03723H","Support stabilized PtCu single-atom alloys for propane dehydrogenation","N/A","N/A","Xiaohe Liu, Xianhui Wang, Shiyu Zhen, Guodong Sun, Chunlei Pei, Zhi‐Jian Zhao, Jinlong Gong","","","N/A","Success"
"10.1039/D0SC06134D","Hierarchical dynamics in allostery following ATP hydrolysis monitored by single molecule FRET measurements and MD simulations","N/A","N/A","Steffen Wolf, Benedikt Sohmen, Björn Hellenkamp, Johann Thurn, Gerhard Stock, Thorsten Hugel","","","N/A","Success"
"10.1039/D1SC01358K","Controlled coherent dynamics of [VO(TPP)], a prototype molecular nuclear qudit with an electronic ancilla","N/A","N/A","Simone Chicco, Alessandro Chiesa, G. Allodi, Elena Garlatti, Matteo Atzori, Lorenzo Sorace, R. De Renzi, Roberta Sessoli, Stefano Carretta","","","N/A","Success"
"10.1039/D1SC03050G","Charge transport through extended molecular wires with strongly correlated electrons","N/A","N/A","James Oscar Thomas, Jakub K. Sowa, Bart Limburg, Xinya Bian, Charalambos Evangeli, Jacob L. Swett, Sumit Tewari, Jonathan Baugh, George C. Schatz, G. Andrew D. Briggs, Harry L. Anderson, Jan A. Mol","","","N/A","Success"
"10.1039/D1SC03480D","Atomic origins of the strong metal–support interaction in silica supported catalysts","N/A","N/A","Feng Yang, Haofei Zhao, Yan Wang, Lei Wang, Lei Zhang, Tianhui Liu, Jian Sheng, Sheng Zhu, Dongsheng He, Lili Lin, Jiaqing He, Rongming Wang, Yan Li","","","N/A","Success"
"10.1039/D0SC05785A","How many water molecules are needed to solvate one?","N/A","N/A","Alessandro Rognoni, Riccardo Conte, Michele Ceotto","","","N/A","Success"
"10.1039/D2SC04969D","An exchange coupled meso–meso linked vanadyl porphyrin dimer for quantum information processing","N/A","N/A","Davide Ranieri, Fabio Santanni, Alberto Privitera, Andrea Albino, Enrico Salvadori, Mario Chiesa, Federico Totti, Lorenzo Sorace, Roberta Sessoli","","","N/A","Success"
"10.1039/D1SC00187F","Heterocyclic group transfer reactions with I(iii) N-HVI reagents: access to N-alkyl(heteroaryl)onium salts via olefin aminolactonization","N/A","N/A","Anthony F. Tierno, Jennifer C. Walters, Andres Vazquez‐Lopez, Xiao Xiao, Sarah E. Wengryniuk","","","N/A","Success"
"10.1039/D2SC04523K","Formation of exceptional monomeric YPhos–PdCl2complexes with high activities in coupling reactions","N/A","N/A","Ilja Rodstein, Leif Kelling, Julian Löffler, Thorsten Scherpf, Abir Sarbajna, Diego M. Andrada, Viktoria H. Gessner","","","N/A","Success"
"10.1039/D2SC01769E","Zn(ii)-Coordination-driven self-assembled nanoagents for multimodal imaging-guided photothermal/gene synergistic therapy","N/A","N/A","Hui Hu, Nan Yang, Jiahui Sun, Fu Zhou, Rui Gu, Yuan Liu, Li Wang, Xuejiao Song, Ruirui Yun, Xiaochen Dong, Guangfeng Wang","","","N/A","Success"
"10.1039/D1SC04241F","Controlling dispersity in aqueous atom transfer radical polymerization: rapid and quantitative synthesis of one-pot block copolymers","N/A","N/A","Hyun Suk Wang, Kostas Parkatzidis, Simon Harrisson, Nghia P. Truong, Athina Anastasaki","","","N/A","Success"
"10.1039/D3SC02139D","TCMBank: bridges between the largest herbal medicines, chemical ingredients, target proteins, and associated diseases with intelligence text mining","N/A","N/A","Qiujie Lv, Guanxing Chen, Haohuai He, Ziduo Yang, Lu Zhao, Hsin‐Yi Chen, Calvin Yu‐Chian Chen","","","N/A","Success"
